{
  "schemaVersion": 1,
  "sessionEpoch": 1,
  "frameSequence": 1,
  "revision": 1,
  "scene": "east-corridor",
  "objects": [{
    "id": "door-a", "kind": "door", "label": "Door A", "space": "world2d",
    "position": { "x": 640, "y": 180 }, "visibleToPlayer": true, "active": true,
    "agentExposure": "auto", "tags": ["east-corridor"], "state": { "open": false, "locked": true }
  }]
}
